{"schema_version":"synth.candidate.v1","candidate_id":"cand_craftax_ember","kind":"adapter.safetensors","content":{"digest":"sha256:7ce9df59afb31407b1b9ddc2b2504b5c29ca918b9b778713c3c47a5bfa6f2ef1","media_type":"application/x-safetensors","size_bytes":25},"task_contract_digest":"sha256:150ffef953d4fe4275f593c21a85a98d6e0b954a028afa8bfb85b02afe27c3e0","producing_run_id":"run_ember_001","metadata":{"label":"Ember 🌋"},"digest":"sha256:5c2228a4cd67dd7fd027c8e35b0be524f82403d60e29315211f85643ff7e779c"}
